{
  "version": 1,
  "jobId": "run-differential-mixed-61-2000x2700",
  "sheet": {
    "width": 2000,
    "height": 2700,
    "label": "2000x2700"
  },
  "padding": 10,
  "pieces": [
    {
      "id": "604bc424-469c-4ab8-93f1-80c0fc4090b3-copy-1",
      "sourcePieceId": "604bc424-469c-4ab8-93f1-80c0fc4090b3-copy-1",
      "interchangeabilityKey": "604bc424-469c-4ab8-93f1-80c0fc4090b3",
      "realBounds": {
        "x": 0,
        "y": 0,
        "width": 100,
        "height": 60
      },
      "paddedBounds": {
        "x": 0,
        "y": 0,
        "width": 110,
        "height": 70,
        "longestEdge": 110,
        "area": 7700,
        "imbalance": 40
      },
      "padding": 5,
      "allowRotation": true,
      "allowMirror": true
    },
    {
      "id": "604bc424-469c-4ab8-93f1-80c0fc4090b3-copy-2",
      "sourcePieceId": "604bc424-469c-4ab8-93f1-80c0fc4090b3-copy-2",
      "interchangeabilityKey": "604bc424-469c-4ab8-93f1-80c0fc4090b3",
      "realBounds": {
        "x": 0,
        "y": 0,
        "width": 100,
        "height": 60
      },
      "paddedBounds": {
        "x": 0,
        "y": 0,
        "width": 110,
        "height": 70,
        "longestEdge": 110,
        "area": 7700,
        "imbalance": 40
      },
      "padding": 5,
      "allowRotation": true,
      "allowMirror": true
    },
    {
      "id": "604bc424-469c-4ab8-93f1-80c0fc4090b3-copy-3",
      "sourcePieceId": "604bc424-469c-4ab8-93f1-80c0fc4090b3-copy-3",
      "interchangeabilityKey": "604bc424-469c-4ab8-93f1-80c0fc4090b3",
      "realBounds": {
        "x": 0,
        "y": 0,
        "width": 100,
        "height": 60
      },
      "paddedBounds": {
        "x": 0,
        "y": 0,
        "width": 110,
        "height": 70,
        "longestEdge": 110,
        "area": 7700,
        "imbalance": 40
      },
      "padding": 5,
      "allowRotation": true,
      "allowMirror": true
    },
    {
      "id": "604bc424-469c-4ab8-93f1-80c0fc4090b3-copy-4",
      "sourcePieceId": "604bc424-469c-4ab8-93f1-80c0fc4090b3-copy-4",
      "interchangeabilityKey": "604bc424-469c-4ab8-93f1-80c0fc4090b3",
      "realBounds": {
        "x": 0,
        "y": 0,
        "width": 100,
        "height": 60
      },
      "paddedBounds": {
        "x": 0,
        "y": 0,
        "width": 110,
        "height": 70,
        "longestEdge": 110,
        "area": 7700,
        "imbalance": 40
      },
      "padding": 5,
      "allowRotation": true,
      "allowMirror": true
    },
    {
      "id": "604bc424-469c-4ab8-93f1-80c0fc4090b3-copy-5",
      "sourcePieceId": "604bc424-469c-4ab8-93f1-80c0fc4090b3-copy-5",
      "interchangeabilityKey": "604bc424-469c-4ab8-93f1-80c0fc4090b3",
      "realBounds": {
        "x": 0,
        "y": 0,
        "width": 100,
        "height": 60
      },
      "paddedBounds": {
        "x": 0,
        "y": 0,
        "width": 110,
        "height": 70,
        "longestEdge": 110,
        "area": 7700,
        "imbalance": 40
      },
      "padding": 5,
      "allowRotation": true,
      "allowMirror": true
    },
    {
      "id": "54345eb7-a37e-45eb-b0fd-eccffdfa14cc-copy-1",
      "sourcePieceId": "54345eb7-a37e-45eb-b0fd-eccffdfa14cc-copy-1",
      "interchangeabilityKey": "54345eb7-a37e-45eb-b0fd-eccffdfa14cc",
      "realBounds": {
        "x": 0,
        "y": 0,
        "width": 100,
        "height": 40
      },
      "paddedBounds": {
        "x": 0,
        "y": 0,
        "width": 110,
        "height": 50,
        "longestEdge": 110,
        "area": 5500,
        "imbalance": 60
      },
      "padding": 5,
      "allowRotation": true,
      "allowMirror": true
    },
    {
      "id": "54345eb7-a37e-45eb-b0fd-eccffdfa14cc-copy-2",
      "sourcePieceId": "54345eb7-a37e-45eb-b0fd-eccffdfa14cc-copy-2",
      "interchangeabilityKey": "54345eb7-a37e-45eb-b0fd-eccffdfa14cc",
      "realBounds": {
        "x": 0,
        "y": 0,
        "width": 100,
        "height": 40
      },
      "paddedBounds": {
        "x": 0,
        "y": 0,
        "width": 110,
        "height": 50,
        "longestEdge": 110,
        "area": 5500,
        "imbalance": 60
      },
      "padding": 5,
      "allowRotation": true,
      "allowMirror": true
    },
    {
      "id": "54345eb7-a37e-45eb-b0fd-eccffdfa14cc-copy-3",
      "sourcePieceId": "54345eb7-a37e-45eb-b0fd-eccffdfa14cc-copy-3",
      "interchangeabilityKey": "54345eb7-a37e-45eb-b0fd-eccffdfa14cc",
      "realBounds": {
        "x": 0,
        "y": 0,
        "width": 100,
        "height": 40
      },
      "paddedBounds": {
        "x": 0,
        "y": 0,
        "width": 110,
        "height": 50,
        "longestEdge": 110,
        "area": 5500,
        "imbalance": 60
      },
      "padding": 5,
      "allowRotation": true,
      "allowMirror": true
    },
    {
      "id": "54345eb7-a37e-45eb-b0fd-eccffdfa14cc-copy-4",
      "sourcePieceId": "54345eb7-a37e-45eb-b0fd-eccffdfa14cc-copy-4",
      "interchangeabilityKey": "54345eb7-a37e-45eb-b0fd-eccffdfa14cc",
      "realBounds": {
        "x": 0,
        "y": 0,
        "width": 100,
        "height": 40
      },
      "paddedBounds": {
        "x": 0,
        "y": 0,
        "width": 110,
        "height": 50,
        "longestEdge": 110,
        "area": 5500,
        "imbalance": 60
      },
      "padding": 5,
      "allowRotation": true,
      "allowMirror": true
    },
    {
      "id": "54345eb7-a37e-45eb-b0fd-eccffdfa14cc-copy-5",
      "sourcePieceId": "54345eb7-a37e-45eb-b0fd-eccffdfa14cc-copy-5",
      "interchangeabilityKey": "54345eb7-a37e-45eb-b0fd-eccffdfa14cc",
      "realBounds": {
        "x": 0,
        "y": 0,
        "width": 100,
        "height": 40
      },
      "paddedBounds": {
        "x": 0,
        "y": 0,
        "width": 110,
        "height": 50,
        "longestEdge": 110,
        "area": 5500,
        "imbalance": 60
      },
      "padding": 5,
      "allowRotation": true,
      "allowMirror": true
    },
    {
      "id": "b8721c24-33b9-4244-9ce6-fff728f7e73b-copy-1",
      "sourcePieceId": "b8721c24-33b9-4244-9ce6-fff728f7e73b-copy-1",
      "interchangeabilityKey": "b8721c24-33b9-4244-9ce6-fff728f7e73b",
      "realBounds": {
        "x": 0,
        "y": 0,
        "width": 100,
        "height": 40
      },
      "paddedBounds": {
        "x": 0,
        "y": 0,
        "width": 110,
        "height": 50,
        "longestEdge": 110,
        "area": 5500,
        "imbalance": 60
      },
      "padding": 5,
      "allowRotation": true,
      "allowMirror": true
    },
    {
      "id": "b8721c24-33b9-4244-9ce6-fff728f7e73b-copy-2",
      "sourcePieceId": "b8721c24-33b9-4244-9ce6-fff728f7e73b-copy-2",
      "interchangeabilityKey": "b8721c24-33b9-4244-9ce6-fff728f7e73b",
      "realBounds": {
        "x": 0,
        "y": 0,
        "width": 100,
        "height": 40
      },
      "paddedBounds": {
        "x": 0,
        "y": 0,
        "width": 110,
        "height": 50,
        "longestEdge": 110,
        "area": 5500,
        "imbalance": 60
      },
      "padding": 5,
      "allowRotation": true,
      "allowMirror": true
    },
    {
      "id": "b8721c24-33b9-4244-9ce6-fff728f7e73b-copy-3",
      "sourcePieceId": "b8721c24-33b9-4244-9ce6-fff728f7e73b-copy-3",
      "interchangeabilityKey": "b8721c24-33b9-4244-9ce6-fff728f7e73b",
      "realBounds": {
        "x": 0,
        "y": 0,
        "width": 100,
        "height": 40
      },
      "paddedBounds": {
        "x": 0,
        "y": 0,
        "width": 110,
        "height": 50,
        "longestEdge": 110,
        "area": 5500,
        "imbalance": 60
      },
      "padding": 5,
      "allowRotation": true,
      "allowMirror": true
    },
    {
      "id": "b8721c24-33b9-4244-9ce6-fff728f7e73b-copy-4",
      "sourcePieceId": "b8721c24-33b9-4244-9ce6-fff728f7e73b-copy-4",
      "interchangeabilityKey": "b8721c24-33b9-4244-9ce6-fff728f7e73b",
      "realBounds": {
        "x": 0,
        "y": 0,
        "width": 100,
        "height": 40
      },
      "paddedBounds": {
        "x": 0,
        "y": 0,
        "width": 110,
        "height": 50,
        "longestEdge": 110,
        "area": 5500,
        "imbalance": 60
      },
      "padding": 5,
      "allowRotation": true,
      "allowMirror": true
    },
    {
      "id": "0aff79d8-47d7-49b2-958b-8f8648eafc07-copy-1",
      "sourcePieceId": "0aff79d8-47d7-49b2-958b-8f8648eafc07-copy-1",
      "interchangeabilityKey": "0aff79d8-47d7-49b2-958b-8f8648eafc07",
      "realBounds": {
        "x": 0,
        "y": 0,
        "width": 100,
        "height": 100
      },
      "paddedBounds": {
        "x": 0,
        "y": 0,
        "width": 110,
        "height": 110,
        "longestEdge": 110,
        "area": 12100,
        "imbalance": 0
      },
      "padding": 5,
      "allowRotation": true,
      "allowMirror": true
    },
    {
      "id": "0aff79d8-47d7-49b2-958b-8f8648eafc07-copy-2",
      "sourcePieceId": "0aff79d8-47d7-49b2-958b-8f8648eafc07-copy-2",
      "interchangeabilityKey": "0aff79d8-47d7-49b2-958b-8f8648eafc07",
      "realBounds": {
        "x": 0,
        "y": 0,
        "width": 100,
        "height": 100
      },
      "paddedBounds": {
        "x": 0,
        "y": 0,
        "width": 110,
        "height": 110,
        "longestEdge": 110,
        "area": 12100,
        "imbalance": 0
      },
      "padding": 5,
      "allowRotation": true,
      "allowMirror": true
    },
    {
      "id": "0aff79d8-47d7-49b2-958b-8f8648eafc07-copy-3",
      "sourcePieceId": "0aff79d8-47d7-49b2-958b-8f8648eafc07-copy-3",
      "interchangeabilityKey": "0aff79d8-47d7-49b2-958b-8f8648eafc07",
      "realBounds": {
        "x": 0,
        "y": 0,
        "width": 100,
        "height": 100
      },
      "paddedBounds": {
        "x": 0,
        "y": 0,
        "width": 110,
        "height": 110,
        "longestEdge": 110,
        "area": 12100,
        "imbalance": 0
      },
      "padding": 5,
      "allowRotation": true,
      "allowMirror": true
    },